{
  "model": "KONA Pulse Counter",
  "manufacturer": "TEKTELIC",
  "category": "metering",
  "sensorType": "metering",
  "payloadVersion": "1.0.0",
  "samples": [
    {
      "description": "Pulse count reading",
      "decoded_payload": {
        "pulse_count": 1234,
        "total_count": 5678
      }
    },
    {
      "description": "Reset state",
      "decoded_payload": {
        "pulse_count": 0,
        "total_count": 10000
      }
    }
  ],
  "fieldSchema": {
    "pulse_count": {
      "type": "integer",
      "minimum": 0
    },
    "total_count": {
      "type": "integer",
      "minimum": 0
    }
  },
  "discriminators": ["pulse_count", "total_count"],
  "notes": "TEKTELIC KONA Pulse Counter"
}
