{
  "model": "LDDS75",
  "manufacturer": "Dragino",
  "category": "leak",
  "sensorType": "leak",
  "payloadVersion": "1.0.0",
  "samples": [
    {
      "description": "Water leak detected",
      "decoded_payload": {
        "water_leak": true,
        "battery_level": 80
      }
    },
    {
      "description": "No water leak",
      "decoded_payload": {
        "water_leak": false,
        "battery_level": 85
      }
    }
  ],
  "fieldSchema": {
    "water_leak": {
      "type": "boolean"
    },
    "battery_level": {
      "type": "integer",
      "minimum": 0,
      "maximum": 100
    }
  },
  "discriminators": ["water_leak"],
  "notes": "Dragino LDDS75 Water Leak Detection Sensor"
}
