{
  "model": "DS3604",
  "manufacturer": "Milesight",
  "category": "door",
  "sensorType": "door",
  "payloadVersion": "1.0.0",
  "samples": [
    {
      "description": "Door closed (0 = closed)",
      "decoded_payload": {
        "open_close": 0,
        "battery_level": 95
      }
    },
    {
      "description": "Door open (1 = open)",
      "decoded_payload": {
        "open_close": 1,
        "battery_level": 90
      }
    }
  ],
  "fieldSchema": {
    "open_close": {
      "type": "integer",
      "enum": [0, 1]
    },
    "battery_level": {
      "type": "integer",
      "minimum": 0,
      "maximum": 100
    }
  },
  "discriminators": ["open_close"],
  "notes": "Milesight DS3604 Door Sensor. Uses numeric open_close field (0=closed, 1=open)."
}
