{
  "model": "R311A",
  "manufacturer": "Netvox",
  "category": "door",
  "sensorType": "door",
  "payloadVersion": "1.0.0",
  "samples": [
    {
      "description": "Door open (true = open)",
      "decoded_payload": {
        "door": true,
        "battery_voltage": 3.0
      }
    },
    {
      "description": "Door closed (false = closed)",
      "decoded_payload": {
        "door": false,
        "battery_voltage": 2.8
      }
    }
  ],
  "fieldSchema": {
    "door": {
      "type": "boolean"
    },
    "battery_voltage": {
      "type": "number",
      "minimum": 0,
      "maximum": 4.5
    }
  },
  "discriminators": ["door"],
  "notes": "Netvox R311A Door/Window Sensor. Uses boolean 'door' field instead of string status."
}
