{
  "model": "EM300-MCS",
  "manufacturer": "Milesight",
  "category": "multi_sensor",
  "sensorType": "temperature",
  "payloadVersion": "1.0.0",
  "samples": [
    {
      "description": "Door closed, normal temperature",
      "decoded_payload": {
        "temperature": 22.0,
        "humidity": 50,
        "door_status": "closed",
        "battery_level": 85
      }
    },
    {
      "description": "Door open, cold temperature",
      "decoded_payload": {
        "temperature": -18.5,
        "humidity": 35,
        "door_status": "open",
        "battery_level": 80
      }
    }
  ],
  "fieldSchema": {
    "temperature": {
      "type": "number"
    },
    "humidity": {
      "type": "number",
      "minimum": 0,
      "maximum": 100
    },
    "door_status": {
      "type": "string",
      "enum": ["open", "closed"]
    },
    "battery_level": {
      "type": "integer",
      "minimum": 0,
      "maximum": 100
    }
  },
  "discriminators": ["temperature", "humidity", "door_status"],
  "notes": "Milesight EM300-MCS Multi-Sensor (Temperature + Humidity + Door)"
}
