{
  "model": "EM300-TH",
  "manufacturer": "Milesight",
  "category": "temperature_humidity",
  "sensorType": "temperature",
  "payloadVersion": "1.0.0",
  "samples": [
    {
      "description": "Normal room conditions",
      "decoded_payload": {
        "temperature": 22.1,
        "humidity": 45.3,
        "battery_level": 95
      }
    },
    {
      "description": "Cold conditions",
      "decoded_payload": {
        "temperature": -18.5,
        "humidity": 30.0,
        "battery_level": 88
      }
    },
    {
      "description": "High humidity",
      "decoded_payload": {
        "temperature": 25.0,
        "humidity": 85.5,
        "battery_level": 72
      }
    }
  ],
  "fieldSchema": {
    "temperature": {
      "type": "number",
      "minimum": -40,
      "maximum": 125
    },
    "humidity": {
      "type": "number",
      "minimum": 0,
      "maximum": 100
    },
    "battery_level": {
      "type": "integer",
      "minimum": 0,
      "maximum": 100
    }
  },
  "discriminators": ["temperature", "humidity"],
  "notes": "Milesight EM300-TH Temperature & Humidity Sensor"
}
