{
  "model": "ERS",
  "manufacturer": "Elsys",
  "category": "temperature_humidity",
  "sensorType": "temperature",
  "payloadVersion": "1.0.0",
  "samples": [
    {
      "description": "Normal office conditions",
      "decoded_payload": {
        "temperature": 21.5,
        "humidity": 50.0,
        "battery_level": 100
      }
    },
    {
      "description": "Dry conditions",
      "decoded_payload": {
        "temperature": 23.0,
        "humidity": 25.0,
        "battery_level": 95
      }
    }
  ],
  "fieldSchema": {
    "temperature": {
      "type": "number"
    },
    "humidity": {
      "type": "number",
      "minimum": 0,
      "maximum": 100
    },
    "battery_level": {
      "type": "integer",
      "minimum": 0,
      "maximum": 100
    }
  },
  "discriminators": ["temperature", "humidity"],
  "notes": "Elsys ERS Temperature & Humidity Sensor"
}
