{
  "model": "LDS02",
  "manufacturer": "Dragino",
  "category": "door",
  "sensorType": "door",
  "payloadVersion": "1.0.0",
  "samples": [
    {
      "description": "Door closed with good battery",
      "decoded_payload": {
        "door_status": "closed",
        "battery_level": 90
      }
    },
    {
      "description": "Door open with good battery",
      "decoded_payload": {
        "door_status": "open",
        "battery_level": 85
      }
    },
    {
      "description": "Door closed with low battery",
      "decoded_payload": {
        "door_status": "closed",
        "battery_level": 15
      }
    }
  ],
  "fieldSchema": {
    "door_status": {
      "type": "string",
      "enum": ["open", "closed"]
    },
    "battery_level": {
      "type": "integer",
      "minimum": 0,
      "maximum": 100
    }
  },
  "discriminators": ["door_status"],
  "notes": "Dragino LDS02 LoRaWAN Door Sensor"
}
