{
  "model": "LT-22222-L",
  "manufacturer": "Dragino",
  "category": "gps",
  "sensorType": "gps",
  "payloadVersion": "1.0.0",
  "samples": [
    {
      "description": "Valid GPS fix",
      "decoded_payload": {
        "latitude": 40.7128,
        "longitude": -74.0060,
        "battery_level": 75
      }
    },
    {
      "description": "Moving location",
      "decoded_payload": {
        "latitude": 40.7580,
        "longitude": -73.9855,
        "battery_level": 70
      }
    }
  ],
  "fieldSchema": {
    "latitude": {
      "type": "number",
      "minimum": -90,
      "maximum": 90
    },
    "longitude": {
      "type": "number",
      "minimum": -180,
      "maximum": 180
    },
    "battery_level": {
      "type": "integer",
      "minimum": 0,
      "maximum": 100
    }
  },
  "discriminators": ["latitude", "longitude"],
  "notes": "Dragino LT-22222-L GPS Tracker"
}
